Headline,Link,Summary
"Build-A-Bear Workshop is a bright spot in retail even with tariffs, dwindling mall traffic",https://www.cnbc.com/2025/09/22/build-a-bear-workshop-stock-revenue.html," In this article For 26-year-old Cammie Craycroft’s friends, the perfect birthday activity this summer was a group trip toBuild-A-Bear Workshop."
"Why Costco, Sam’s Club and BJ’s are opening new stores and gaining members",https://www.cnbc.com/2025/09/20/costco-sams-club-and-bjs-open-new-stores-and-gain-members-.html," In this article On Costco’s last earnings call, executives were grilled about a problem few companies have: how is the company managing crowded stores and jammed-up parking lots?"
Luxury face cream from a pizza parlor: Inside fraud on Walmart.com,https://www.cnbc.com/2025/09/19/walmart-marketplace-fakes-scams-investigation.html," In this article When Mary May started buying from third-party sellers onWalmart’s online marketplace, she said she assumed the products she was purchasing were the same as the ones she’d long bought in stores."
5 takeaways from CNBC’s investigation into Walmart Marketplace,https://www.cnbc.com/2025/09/19/walmart-marketplace-fakes-scams-investigation-takeaways.html," In this article Walmart’s online marketplace has become a key part of its strategy to grow profit faster than sales and better compete against its longtime rival,Amazon."
Trump is threatening broadcast station licenses. Here’s what that means,https://www.cnbc.com/2025/09/19/trump-threatening-broadcast-station-licenses-explained.html, In this article Disney’sdecision this week topull “Jimmy Kimmel Live!”from its broadcast network ABC is shining a light on a part of the media business over which the federal government has control.
RFK Jr.’s vaccine panel weakens Covid shot recommendations,https://www.cnbc.com/2025/09/19/rfk-jr-vaccine-panel-covid-shot-recommendations.html," Health and Human Services Secretary Robert F. Kennedy Jr.’s hand-picked vaccine panel on Friday weakened Covid shot recommendations in the U.S., advising that all Americans consult a health-care provider before deciding whether to receive the vaccine. The 12-member panel, called the Advisory Committee on Immunization Practices, or ACIP, recommended that people 6 months and up receive vaccines based on so-called “shared clinical decision-making,” which refers to a decision process between a health-care provider and a patient or their guardian. The group also voted to emphasize that for those under 65, the Covid vaccine is most beneficial for those at high risk of severe illness from the disease."
"How to avoid buying fakes on Walmart, Amazon and other online marketplaces",https://www.cnbc.com/2025/09/19/avoid-buying-fake-products-online-marketplaces.html," In this article As more consumers prioritize convenience and value over brand loyalty, experts say they’re turning to online marketplaces more than ever to buy the things they need, raising the risk they could inadvertently purchase a fake product."
RFK Jr.‘s vaccine panel postpones vote on babies’ first hepatitis B shot,https://www.cnbc.com/2025/09/19/rfk-jrs-vaccine-panel-postpones-vote-on-hepatitis-b-shot-for-babies.html," Health and Human Services Secretary Robert F. Kennedy Jr.’s hand-pickedvaccine panelon Friday postponed a vote on whether to delay the first dose of the hepatitis B shot from birth to at least one month for most babies born in the U.S. The decision means that the committee’scurrent recommendation– that all infants receive a hepatitis B vaccine within 24 hours of birth – will stay in place until the group meets again at a later date. It’s unclear when the panel, called the Advisory Committee on Immunization Practices, or ACIP, will convene again to discuss the hepatitis B shot."
Family offices still keen on direct deals but dial back early-stage investing,https://www.cnbc.com/2025/09/22/family-offices-direct-investing-private-equity-citi-survey.html," Sign up for the newInside Alts newsletter A version of this article first appeared in CNBC’s Inside Wealth newsletter with Robert Frank, a weekly guide to the high-net-worth investor and consumer.Sign upto receive future editions, straight to your inbox."
Comcast’s Versant reports declining annual profit as it prepares to go public,https://www.cnbc.com/2025/09/18/comcast-versant-annual-profit-public.html," In this article Versant,Comcast’sspinoff of the majority of its NBCUniversal cable network portfolio, is gearing up to go public."
FedEx stock rises on better-than-expected earnings,https://www.cnbc.com/2025/09/18/fedex-fdx-q1-2026-earnings.html, In this article FedExbeat on the top and bottom lines in its fiscal first-quarter earnings report on Thursday.
"Trump’s pressure on the media is mounting, with Kimmel sidelined ‘indefinitely’",https://www.cnbc.com/2025/09/18/jimmy-kimmel-trump-pressure-on-the-media-mounting.html, In this article PresidentDonald Trump’spressure on media companies is mounting.
"AmEx unveils refreshed Platinum card with $895 annual fee, $3,500 in perks",https://www.cnbc.com/2025/09/18/american-express-platinum-card-refresh-895-fee-3500-perks.html, In this article American Expresson Thursday unveiledupdatesto its flagship credit card amid heightened industry competition over the country’s high spenders.
Darden Restaurants disappoints on earnings but hikes sales outlook,https://www.cnbc.com/2025/09/18/darden-restaurants-dri-q1-2026-earnings.html," In this article Darden Restaurantson Thursday reported mixed quarterly results, as Olive Garden and LongHorn Steakhouse helped offset weakness in its fine-dining business."
Larry Ellison’s $365 billion fortune breaks every rule of wealth management,https://www.cnbc.com/2025/09/18/larry-ellison-365-billion-fortune-wealth-management.html, Sign up for the newInside Alts newsletter In this article
Covid shot access at stake as RFK Jr.’s hand-picked vaccine panel convenes,https://www.cnbc.com/2025/09/18/covid-shot-access-coverage-at-stake-as-rfk-jrs-vaccine-panel-meets-.html," Covid shot accessand coverage in the U.S. hang in the balance as an influential governmentvaccine panel hand-pickedby Health and Human Services Secretary Robert F. Kennedy Jr. convenes this week in Atlanta. The panel, called the Advisory Committee on Immunization Practices, or ACIP, is scheduled to vote on recommendations for Covid jabs and childhood immunizations for hepatitis B and measles, mumps, rubella, and varicella, or MMRV. Kennedy has gutted and restacked that committee with new members, some of whom are vaccine critics, raising concerns that they could soften,delayor fully eliminate recommendations for routine shots proven to be safe and effective."
Hyundai outlines U.S. growth plans weeks after ICE immigration raid,https://www.cnbc.com/2025/09/18/2025-hyundai-investor-event.html," NEW YORK —Hyundai Motorreinforced aggressive growth plans Thursday through the end of the decade, despite lowering its profit outlook for the year due to tariffs. The new targets call for an operating profit margin this year of between 6% and 7%, down from 7% to 8%, and an increase in revenue of between 5% and 6% — up 2 percentage points — compared with175.2 trillionSouth Korean won (US$12.7 billion) in 2024."
"Spirit CEO says airline will slash flights, could cut jobs",https://www.cnbc.com/2025/09/17/spirit-ceo-flight-cuts.html," Spirit AirlinesCEO Dave Davis on Wednesday braced staff for more job cuts and said the carrier plans to slash its schedule in November to reduce costs weeks after declaring itssecond bankruptcyin less than a year. The airline is planning its November schedule and Davis told employees in a memo, which was reviewed by CNBC, that they will see a 25% cut in capacity over 2024 “as we optimize our network to focus on our strongest markets.”"
Cracker Barrel says company is focusing on ‘guest experience’ after backlash,https://www.cnbc.com/2025/09/17/cracker-barrel-q4-2025-earnings.html, In this article Cracker Barrel Old Country Storesaid Wednesday that the restaurant chain is focusing on enhancing its experiences for guests after it faced intense backlash over an attempted rebrand earlier this summer.
Frontier CEO fires back at United CEO’s criticism of discount airlines,https://www.cnbc.com/2025/09/17/frontier-united-discount-airlines-barry-biffle.html, In this article Frontier AirlinesCEO Barry Biffle fired back at his counterpart atUnited Airlineswho said the deep-discount model in the U.S. is dead.
