Headline,Link,Summary,Published
Wall Street futures on stronger footing as government shutdown concerns take center stage,https://www.investing.com/news/economy-news/wall-street-futures-on-stronger-footing-as-government-shutdown-concerns-take-center-stage-4259880,"(Reuters) -U.S. stock index futures rose on Monday, in a firm start to a potentially eventful week, as investors await remarks...",7 minutes ago
Japan says economy recovering but US tariff impact seen in auto sector,https://www.investing.com/news/economy-news/japan-says-economy-recovering-but-us-tariff-impact-seen-in-auto-sector-4259865,TOKYO (Reuters) -Japan’s government said on Monday that the economy was recovering moderately but that impact from U.S. trade...,26 minutes ago
"Musk’s X ’deeply concerned’ by Indian court order over content takedown, plans appeal",https://www.investing.com/news/economy-news/musks-x-says-to-appeal-indian-court-order-on-contentremovalsystem-4259428,"(Reuters) -Social media platform X said on Monday that it was ""deeply concerned"" by an Indian court’s ruling that quashed its...",32 minutes ago
"Riksbank finished easing after September cut, minutes of meeting show",https://www.investing.com/news/economy-news/swedish-central-bank-done-with-easing-after-cut-minutes-of-meeting-show-4259726,"STOCKHOLM (Reuters) -A monetary policy easing cycle in Sweden that has seen eight interest rate cuts since spring last year,...",1 hour ago
"Under Trump, US cedes its share of China’s beef market to Australia",https://www.investing.com/news/economy-news/under-trump-us-cedes-its-share-of-chinas-beef-market-to-australia-4259764,By Peter Hobson and Tom Polansek CANBERRA/CHICAGO (Reuters) -Australian beef has replaced U.S. supply in China since President...,1 hour ago
"Dollar falls before US data amid shutdown concerns, yen outperforms",https://www.investing.com/news/economy-news/dollar-on-the-defensive-before-data-releases-risk-of-us-government-shutdown-4259404,"By Stefano Rebaudo and Rae Wee (Reuters) -The dollar dropped on Monday amid concerns over a potential government shutdown, with...",1 hour ago
NFPs ahead this week as possible U.S. shutdown looms - what’s moving markets,https://www.investing.com/news/economy-news/nfps-ahead-this-week-as-possible-us-shutdown-looms--whats-moving-markets-4259711,Investing.com - U.S. stock futures edge higher ahead of a trading week that is set to feature crucial economic data and drama over...,2 hours ago
Investors look past AI hype to long-term opportunities from government spending,https://www.investing.com/news/economy-news/investors-look-past-ai-hype-to-longterm-opportunities-from-government-spending-4259651,By Divya Chowdhury MUMBAI -Some of the world’s biggest investors are looking beyond a boom in artificial intelligence to...,2 hours ago
Dovish BOJ policymaker sees rate hike need rising ’more than ever’,https://www.investing.com/news/economy-news/dovish-boj-policymaker-sees-rate-hike-need-rising-more-than-ever-4259634,By Leika Kihara TOKYO (Reuters) -A dovish Bank of Japan board member said on Monday the need for an interest rate hike was...,2 hours ago
Take Five: The Final Countdown,https://www.investing.com/news/economy-news/take-five-the-final-countdown-4259600,"(Reuters) -As markets gear up for the home stretch of an eventful year, key data in the U.S. and in Japan is due, while the week...",3 hours ago
"China’s factory activity likely slows again amid weak demand, trade tensions: Reuters poll",https://www.investing.com/news/economy-news/chinas-factory-activity-likely-slows-again-amid-weak-demand-trade-tensions-reuters-poll-4259479,"BEIJING (Reuters) -China’s factory activity probably shrank for a sixth straight month in September, keeping alive calls for more...",3 hours ago
Morning Bid: Who needs a government anyway?,https://www.investing.com/news/economy-news/morning-bid-who-needs-a-government-anyway-4259421,(Reuters) -A look at the day ahead in European and global markets from Wayne Cole. Treasury yields and the dollar are down and...,5 hours ago
Thailand’s new PM outlines policies to parliament amid economic challenges,https://www.investing.com/news/economy-news/thailands-new-pm-outlines-policies-to-parliament-amid-economic-challenges-4259417,"BANGKOK (Reuters) -Thai Prime Minister Anutin Charnvirakul on Monday outlined his government’s policy agenda to parliament,...",5 hours ago
"RBA preview Sept: rates on hold amid sticky inflation, Bullock comments awaited",https://www.investing.com/news/economy-news/rba-preview-sept-rates-on-hold-amid-sticky-inflation-bullock-comments-awaited-4259415,Investing.com-- The Reserve Bank of Australia is widely expected to leave interest rates unchanged at the conclusion of a meeting...,6 hours ago
Analysis-BOJ board’s hawkish flex lowers bar for an October rate hike,https://www.investing.com/news/economy-news/analysisboj-boards-hawkish-flex-lowers-bar-for-an-october-rate-hike-4259399,By Leika Kihara TOKYO (Reuters) -A hawkish board split at the Bank of Japan’s policy meeting this month has increased pressure on...,8 hours ago
"RBI expected to hold policy rate, but surprise cut possible",https://www.investing.com/news/economy-news/rbi-expected-to-hold-policy-rate-but-surprise-cut-possible-4259406,"By Swati Bhat MUMBAI (Reuters) -The Reserve Bank of India is widely expected to hold its key policy rate at 5.50% on Wednesday,...",8 hours ago
Trump considering electronics tariffs based on chip content- Reuters,https://www.investing.com/news/economy-news/trump-considering-electronics-tariffs-based-on-chip-content-reuters-4259401,Investing.com-- The Donald Trump administration is considering imposing tariffs on electronic devices based on the number of chips...,8 hours ago
"UK job postings fall, firms downbeat about outlook, surveys show",https://www.investing.com/news/economy-news/uk-job-postings-fall-firms-downbeat-about-outlook-surveys-show-4259392,By Suban Abdulla LONDON (Reuters) -Britain’s labour market is showing more signs of cooling and businesses remain negative about...,9 hours ago
Republicans urge Democrats to agree to short-term bill to keep US government open,https://www.investing.com/news/economy-news/republicans-urge-democrats-to-agree-to-shortterm-bill-to-keep-us-government-open-4259378,"By James Oliphant and Steve Holland WASHINGTON (Reuters) -Ahead of a meeting between lawmakers and President Donald Trump, the...",14 hours ago
"’Backdoor’ funding cuts possible by Trump administration, as Congress faces government shutdown",https://www.investing.com/news/economy-news/backdoor-funding-cuts-possible-by-trump-administration-as-congress-faces-government-shutdown-4259349,"By Bo Erickson WASHINGTON (Reuters) -With three days to go before a U.S. government shutdown, an advocacy group that tracks...",23 hours ago
Young workers fear AI’s impact on their jobs more than older colleagues - DB,https://www.investing.com/news/economy-news/young-workers-fear-ais-impact-on-their-jobs-more-than-older-colleagues--db-4253669,"Investing.com - Young workers are fearful that advances in artificial intelligence could cost them their jobs, while their older...",23 hours ago
Global data center spending to top $500 bln in 2025: What you need to know,https://www.investing.com/news/economy-news/global-data-center-spending-to-top-500-bln-in-2025-what-you-need-to-know-4253422,"Investing.com -- Global spending on data centers is set to surpass $500 billion in 2025, according to BofA Global Research in a...","Sep 28, 2025"
"US agrees South Korea not a currency manipulator, Seoul says",https://www.investing.com/news/economy-news/south-korea-us-reach-an-agreement-over-foreign-exchange-deal-seoul-says-4259204,By Heejin Kim and Cynthia Kim SEOUL (Reuters) -The United States has agreed that South Korea is not manipulating its currency for...,"Sep 28, 2025"
"Trump to meet top Congressional leaders on Monday, White House official says",https://www.investing.com/news/economy-news/trump-to-meet-top-congressional-leaders-on-monday-white-house-official-says-4259202,WASHINGTON (Reuters) -U.S. President Donald Trump will meet with the top Democratic and Republican leaders in Congress on Monday...,"Sep 27, 2025"
Who’s who in the Fed’s latest dot plot,https://www.investing.com/news/economy-news/whos-who-in-the-feds-latest-dot-plot-4251977,"Investing.com --The Federal Reserve’s September FOMC meeting made clear that while the Committee agrees a 25bps cut was due, it...","Sep 27, 2025"
U.S. government shutdown a modest drag but fresh blow to credibility: BofA,https://www.investing.com/news/economy-news/us-shutdown-a-modest-drag-but-fresh-blow-to-credibility-4258279,"Investing.com -- A U.S. government shutdown is looming, but markets have little reason to panic. According to Bank of America the...","Sep 27, 2025"
3 upcoming macro catalysts that could shape China expectations,https://www.investing.com/news/economy-news/3-upcoming-macro-catalysts-that-could-shape-china-expectations-4251331,"Investing.com -- China’s economy is facing weakening fundamentals even as stock markets show resilience, and three upcoming events...","Sep 27, 2025"
"Wall Street ends higher after as-expected inflation data; S&P 500, Nasdaq post weekly declines",https://www.investing.com/news/economy-news/wall-street-futures-mixed-as-investors-brace-for-inflation-data-4257169,"By Caroline Valetkevitch NEW YORK (Reuters) - U.S. stocks ended higher on Friday after mostly in-line U.S. inflation data, but...","Sep 26, 2025"
Top Wall St regulator says he will review White House call for layoff plans,https://www.investing.com/news/economy-news/top-wall-st-regulator-says-he-will-review-white-house-call-for-layoff-plans-4256708,(This Sept 25 story has been repeated with no changes to text.) WASHINGTON (Reuters) -The head of the U.S. Securities and...,"Sep 26, 2025"
"Britain would face 100% tariff on pharmaceuticals under latest Trump plan, sources say",https://www.investing.com/news/economy-news/britain-would-face-100-tariff-on-pharmaceuticals-under-latest-trump-plan-sources-say-4258209,By Jarrett Renshaw WASHINGTON (Reuters) -Britain would face 100% tariffs on pharmaceuticals imported into the U.S. under...,"Sep 26, 2025"
