Headline,Link,Summary
I inherited $1.2 million after a tragedy in my family. My low money-market interest rate is ending. What now?,https://www.marketwatch.com/story/i-inherited-1-2-million-after-a-tragedy-in-my-family-my-low-money-market-interest-rate-is-ending-what-now-2f8308b6?mod=mw_rss_topstories,"“Each month, I have been living better because of the interest.”"
Jennifer Lawrence sells gorgeous $11 million Beverly Hills home in off-market deal,https://www.marketwatch.com/story/jennifer-lawrence-sells-gorgeous-11-million-beverly-hills-home-in-off-market-deal-eea8bbfe?mod=mw_rss_topstories,"The actress, who gave birth to her second child with husband Cooke Maroney at the end of March, appears to be mainly based in New York now."
Sabrina Carpenter buys plush penthouse in Tribeca for $10.5 million,https://www.marketwatch.com/story/sabrina-carpenter-buys-plush-penthouse-in-tribeca-for-10-5-million-6a1197e4?mod=mw_rss_topstories,Sabrina Carpenter may be ready to give fans a real-life “House Tour” after reportedly purchasing a $10.5 million penthouse inside a celebrity-loved New York City building.
A giant JPMorgan fund just reset its hedging strategy. What it did and what it means.,https://www.marketwatch.com/story/a-giant-jpmorgan-fund-just-reset-its-hedging-strategy-what-it-did-and-what-it-means-77b9937c?mod=mw_rss_topstories,A big JPMorgan fund reset a hedging strategy in a move that could impact the broader stock market at the end of the year.
"As government shuts down, here’s how much your health insurance could go up next year",https://www.marketwatch.com/story/heres-how-much-your-health-insurance-could-go-up-next-year-whether-theres-a-government-shutdown-or-not-4177a8ae?mod=mw_rss_topstories,Millions of Americans are poised to pay more for their health insurance next year.
The U.S. federal government just shut down. Here’s what it means for you and your money.,https://www.marketwatch.com/story/the-u-s-federal-government-just-shut-down-heres-what-it-means-for-you-and-your-money-6952e209?mod=mw_rss_topstories,"Here’s how the partial shutdown could affect investments, paychecks, economic releases, benefit programs, tourist sites run by the federal government and more."
"Tesla deliveries should see a positive breakout and fuel a stock rally, analyst says",https://www.marketwatch.com/story/tesla-deliveries-should-see-a-positive-breakout-and-fuel-a-stock-rally-analyst-says-c4de4f54?mod=mw_rss_topstories,"Tesla should report quarterly deliveries this week that show a positive break in trend, Canaccord says."
Why Warren Buffett’s Berkshire Hathaway may be placing another bet in petrochemicals,https://www.marketwatch.com/story/why-warren-buffetts-berkshire-hathaway-may-be-placing-another-bet-in-petrochemicals-681c4534?mod=mw_rss_topstories,"Berkshire is in talks to buy Occidental’s chemicals business for $10 billion. A deal would come as a surprise for markets, analysts say."
"Nike warns turnaround ‘won’t be linear,’ but sees signs of life at retail chains",https://www.marketwatch.com/story/nikes-results-top-expectations-but-company-warns-its-recovery-will-not-be-linear-e9ea7fab?mod=mw_rss_topstories,"Shares of Nike Inc. moved higher in extended trading Tuesday after the sneaker maker reported fiscal first-quarter results that topped Wall Street’s estimates, helped by a surprise sales gain."
AI power-generation and Trump play Fermi sees strong demand for its IPO,https://www.marketwatch.com/story/ai-power-generation-and-trump-play-fermi-sees-strong-demand-for-its-ipo-1cfbcd09?mod=mw_rss_topstories,"Fermi’s IPO prices on high end of its expected range, as investors look to take part in a new AI — and Donald J. Trump — play."
